review,movie,studio,release_date,genres,rate,author,date,link
"While Cars 2 is visually stunning, it is the first Pixar film to feel a bit empty at its shiny center.  Mater dominates the proceedings (a major part of the film's problem since he works better as a supporting player) unwittingly working as a spy while Lightning McQueen races in the World Grand Prix.   This is the first Pixar film that seems geared almost entirely for kids which is a bit of a disappointment.  Still, there is enough inventiveness and chuckles to makes it a tolerable vieweing experience.",Cars 2,Walt Disney Studios Motion Pictures,"June 24, 2011","['Comedy', 'Animation']",6,BKM,"Jul 18, 2011",https://www.metacritic.com/movie/cars-2/user-reviews
"While not the best Pixar film, still better than most animated films, and thourghly enjoyableThe haters rating it a 0 just because they want to see pixar fall is pathetic, nothing should deserve a 0",Cars 2,Walt Disney Studios Motion Pictures,"June 24, 2011","['Comedy', 'Animation']",8,loserb0i,"Aug  1, 2011",https://www.metacritic.com/movie/cars-2/user-reviews
"""Cars 2"" does not meet the normal standards of other Pixar films, like ""Toy Story 3"" or ""Wall-E"". However, ""Cars 2"" is a major improvement from the first one. The soundtracks are awesome and resemble those of real spy movies. Overall, ""Cars 2"" is packed with action, but contains jokes that are lame and few boring, tedious scenes. Although ""Cars 2"" does not meet Pixar standards, it does a better job than other animated films. Yes, ""Cars 2"" is not the best movie, but it is a wonderful movie to watch during the summer and blow away your heat and sweat. The extra price for 3D is worth it and the visual effects are stunning! ""Cars 2"" is a disappointment, compared to films like ""Toy Story 3"" and ""Up"", but still manages to make the audience packed with action.",Cars 2,Walt Disney Studios Motion Pictures,"June 24, 2011","['Comedy', 'Animation']",8,sangwon95,"Jul 20, 2011",https://www.metacritic.com/movie/cars-2/user-reviews
i loved this movie it was so beautiful in the lesson it taught that friends are friends and you cant expect them to change and i cant believe the critics hated it so much saying ooh it ventured from lighting mcqueen well i thought that cars 2 was great the way it was matter is the character most kids love not because he was a main character  but because hes funny over all i would give it a 90 out of 100,Cars 2,Walt Disney Studios Motion Pictures,"June 24, 2011","['Comedy', 'Animation']",10,inuyashalover,"Jul 11, 2012",https://www.metacritic.com/movie/cars-2/user-reviews
"""FINALLY! IT HAPPENED! A PIXAR FILM HAS RECEIVED A ""ROTTEN"" ON ROTTEN TOMATOES!!! WE CAN FINALLY CELEBRATE!!!""Okay, fine, you can have your moment, guys (don't worry, that's the last time I'll bring them into this, because I don't want the joke to stale out). After years upon years of critical success, Pixar's first true ""misstep"" arrived in 2011 in the form of ""Cars 2,"" the sequel that not many were really craving in the first place, but it was made nonetheless and it became the first Pixar film to earn a ""rotten"" score on Rotten Tomatoes. Harsh, I know. All things considered, though, I personally enjoyed the film. I get why people didn't really like it (it wasn't the most poignant of Pixar films, nor was it the film with the most heart), but all in all, it was a really fun ride with some brilliant animation, exciting action scenes and good voice acting. Sure, it's silly, it's kiddy and it's not what we're used to out of Pixar, but ""Cars 2"" is still a pretty entertaining romp for the whole family.",Cars 2,Walt Disney Studios Motion Pictures,"June 24, 2011","['Comedy', 'Animation']",8,FreedomFighters,"Dec 12, 2016",https://www.metacritic.com/movie/cars-2/user-reviews
"This film had a very compelling story, a relatable cast of characters, and beautiful settings. The spy plot complemented the story very well, I thought the shift of focus from McQueen to Mater was done perfectly. I really liked characters like Francesco and Finn. The film begins with an exciting and suspenseful scene on an oil rig, letting us know the character Finn will be, and giving us a taste of what the movie will be like. I also like the scene with the ""Lemon Party"" It was a very crucial and important scene that was very intense serious and suspenseful, this was complemented by Maters happy-go-lucky attitude. The film ends with Mater getting knighted in honor of his efforts to save London. This had to be one of the most beautiful moments in film history. After that, Mater and the gang went back to Radiator Springs, completing the hero's journey. In my words, Cars 2 has to be one of the best films is Cinema History",Cars 2,Walt Disney Studios Motion Pictures,"June 24, 2011","['Comedy', 'Animation']",10,yespacitler,"Sep 14, 2018",https://www.metacritic.com/movie/cars-2/user-reviews
"There are some thoughts that people will think that they gonna hate the sequel, and so does the original that the audience won't like the premise of Cars. I know people likes it or hates it, but I have to say that Cars 2 was really fun to watch and it's very exciting adventure better than the first one. The only thing that I really like in this sequel is secret agents, countries, action, adventure, and new fancy places. That's all I really enjoy myself watching this. Anyways, the story is more better developed that they make a new idea for the sequel that Lighting McQueen and Mater are going to the international world cup to win the race and then there are two secret agent spies that are facing with the bad villain who wants to destroy the cars who filled with oil. The voice acting did great and I really enjoy the new characters that they can bring more fun and more exciting to be decent and cool. The animation is pretty cool and the action scenes were awesome. I really like when the cars are chasing around with guns, explosions, and high-tech gadgets in everywhere that they race. But for my opinion, that I take it back when this movie will not be exciting as now and there's more that they came from where people think it's gonna be suck, so it's nice to make a better sequel once again for making a better cars animation. They know exactly what they can do for it and those animators are having fun for it. So that case, see this movie and see how fun that this movie will take more advantage for better animation, if you think so.",Cars 2,Walt Disney Studios Motion Pictures,"June 24, 2011","['Comedy', 'Animation']",8,DarkCritic,"Jun 24, 2011",https://www.metacritic.com/movie/cars-2/user-reviews
"My 3.5 year old boy loves all Pixar movies, as do I. Cars 2 should be rated PG, not G, as it IS very violent. Guns, explosions, and killing/death are what the entire movie consists of, oh yeah and racing. We are trying to limit the amount of violence/weapons our son intakes. If you remember, even in Toy Story, Woody never had a gun in his holster, always empty.  I don't necesarily mind that Pixar went this route cause it's not there job to cater to young children. I am however disapointed that the MPAA approved a G rating for this film when it CLEARLY should be PG.",Cars 2,Walt Disney Studios Motion Pictures,"June 24, 2011","['Comedy', 'Animation']",4,DrGhettoblaster,"Jun 28, 2011",https://www.metacritic.com/movie/cars-2/user-reviews
"Read some of the reviews and I'm suprised by the responses.  The movie was great in my opinion.  My young son loved it.  The audience, including myself, laughed out loud continually throughout the movie.  Overall it was at least just as good as the first movie, if not better.  As usual pixar runs away with superior animation.  There were lots of humor designed for kids and adults.  This time around the movie was more centered around Mator rather than Mcqueen.  I am going to go against the grain here and say that the plot and storyline were well laid out and put together quite well.  If you like Pixar and the first cars movie, there is no reason you will not like this movie.",Cars 2,Walt Disney Studios Motion Pictures,"June 24, 2011","['Comedy', 'Animation']",10,pisces4200,"Jun 24, 2011",https://www.metacritic.com/movie/cars-2/user-reviews
"I don't understand where all the hate comes from. This movie rocks! It's hilariously funny, it has a powerfully deep message, the characters are so lovable and relatable, and the movie is just so much fun! I thought the first Cars was better, but still loved Cars 2. Ignore the losers on Rotten Tomatoes! Cars 2 is definitely worth seeing (maybe even twice)!",Cars 2,Walt Disney Studios Motion Pictures,"June 24, 2011","['Comedy', 'Animation']",10,ShaZayum1993,"Jun 24, 2011",https://www.metacritic.com/movie/cars-2/user-reviews
Very good sequel to a great animated film.,Cars 2,Walt Disney Studios Motion Pictures,"June 24, 2011","['Comedy', 'Animation']",9,Rikiege,"Dec  7, 2012",https://www.metacritic.com/movie/cars-2/user-reviews
"Truly the weakest pixar movie.It emphasised on random subplots,it was entertatining but i expected alot more!!! plus there is no racing this time so...yeah",Cars 2,Walt Disney Studios Motion Pictures,"June 24, 2011","['Comedy', 'Animation']",4,AgentHeroes,"Jun 27, 2011",https://www.metacritic.com/movie/cars-2/user-reviews
"I saw Cars 2 expecting it to be amazing since Cars was my favourite childhood movie and it was amazing. It was the best Pixar, has the best soundtrack for a pixar and one of the best movies I've ever seen. This was the sequal to my favourite childhood film and it was amazing!",Cars 2,Walt Disney Studios Motion Pictures,"June 24, 2011","['Comedy', 'Animation']",10,CWCgamer,"Aug 13, 2011",https://www.metacritic.com/movie/cars-2/user-reviews
"I thought Pixar was better than this. I thought they were above doing cashgrabs. Well, looks like they've been corupted. Cars 2 is a movie that's made only for the money, and it shows. Yes, it's got great animation, good voice acting, and fun action, but everything else is so below Pixar's and even Dreamworks's level. It's very unfunny, Mater was so annoying, the story was so boring, thrown together, and hollow, and the whole movie is just a very mediocre and boring animated movie. C'mon Pixar. You're better than this crap.",Cars 2,Walt Disney Studios Motion Pictures,"June 24, 2011","['Comedy', 'Animation']",4,Bullet97,"Jun 24, 2011",https://www.metacritic.com/movie/cars-2/user-reviews
"The movie is overly creative with a complex story-telling that is not quite for the kids to understand. I know that Pixar can do better, and I hope they will.",Cars 2,Walt Disney Studios Motion Pictures,"June 24, 2011","['Comedy', 'Animation']",6,grandpajoe6191,"Sep 18, 2011",https://www.metacritic.com/movie/cars-2/user-reviews
"There is absolutely NO way this film is a zero. Yes, it lacks the heart of the first one, yes Mater is the main character, and yes Larry the Cable Guy is an awful comedian, but this movie is still somewhat entertaining. For the record, if you hate Larry the Cable Guy, you probably will hate the movie as he gets about 80% of the screen time. There are a lot of things that kids will not get, but both of my daughters, 7 and 4, enjoyed it. It got a few chuckles out of me, and parts of it were pretty good. I actually really enjoyed how Pixar poked a little good natured fun at the James Bond franchise while trying to weave a story kids will enjoy. Still, rent it on DVD when it comes out, don't spend your money at a theatre to see this. As to the people who say the animation is terrible, I think you might have seen a different movie. I saw it in IMAX 3D and was blown away by the animation. The street scenes, racing scenes, and backgrounds are amazing.",Cars 2,Walt Disney Studios Motion Pictures,"June 24, 2011","['Comedy', 'Animation']",5,utmam,"Jun 25, 2011",https://www.metacritic.com/movie/cars-2/user-reviews
Cars 2 does not have the same flare or attachment to the story and characters as you would expect for a Pixar movie although the solid spy story and well used car puns keep this movie enjoyable. The mane problem I found with this movie is that it was so focused on it's story telling it forgot about the characters in it. While one watches this movie they will feel very distant from the characters but they will recognize the good story and it's complexities.,Cars 2,Walt Disney Studios Motion Pictures,"June 24, 2011","['Comedy', 'Animation']",7,cabrita,"Jun 27, 2011",https://www.metacritic.com/movie/cars-2/user-reviews
"To all of you bashing this movie...REALLY!? Lighten up a bit, ok! Take a moment and think about who this movie is made for. It's not made for you, it's made for your kids. Pixar has set the bar very high, no doubt, but when it comes down to it, they're movies are made for children. I just have to laugh at how people can be angry over a movie that is about talking CARS. Are you also going to tell me that movie is just too unrealistic!? When you see this movie, you should judge it by your children's faces afterwards and not by your issues with the plot or anything else. My 5-1/2 and 4 year old boys LOVED this movie and SO DID I! We will go see it again and I have no doubt it will be even better the second time.",Cars 2,Walt Disney Studios Motion Pictures,"June 24, 2011","['Comedy', 'Animation']",9,Soes72,"Jun 26, 2011",https://www.metacritic.com/movie/cars-2/user-reviews
"This isn't bad, it's just not that good. Way different feel to the first, and pretty much feels like a cash grab. Not for younger kids, but not really sure who would enjoy it!",Cars 2,Walt Disney Studios Motion Pictures,"June 24, 2011","['Comedy', 'Animation']",6,shimano6000,"Jul 16, 2011",https://www.metacritic.com/movie/cars-2/user-reviews
"I actually enjoyed it. It brought back memories of the first, one of my favorite movies. I enjoyed the story, voice acting, action, and humor. It was great.",Cars 2,Walt Disney Studios Motion Pictures,"June 24, 2011","['Comedy', 'Animation']",9,MonkiReviews,"May 27, 2017",https://www.metacritic.com/movie/cars-2/user-reviews
"A VHS copy of the musical ""Hello, Dolly"" is the robot's most-prized possession. ""WALL-E"", a lonely earthbound portable garbage compactor, makes a recording of the duet ""It Only Takes a Moment"" because the song moves him, inspiring the machine to hold his own hand, in imitation of the characters who have fallen for each other, from a long-ago past when the planet was habitable. Nothing green grows on earth anymore. The detritus of human civilization, bearing a color scheme that's nearly monochromatic in its brownness, is all that's left. Overrun by trash, entire populations boarded vast spaceships, leaving WALL-E behind with the endless job of minimizing waste into stacked cubes, while the planetary refugees floated around space in what are, essentially, movable countries, displaced indefinitely from their homes. But what does hardware know about love? How can something made out of microprocessors and integrated circuits develop a consciousness? At what point in time did ""it"" evolve and become a ""he""? It's only a matter of time before robots like Eve(as in Adam &) supplant a human race made morbidly obese by generation upon generation of insentient living. Whereas ""WALL-E"" presents a dystopian take on our extrapolated planet that's easily identifiable, ""Cars 2""(and ""Cars""), obscures the nightmarish elements of a four-wheeled society through the audience's supposition that this largely inorganic world is an alternate one. Under closer scrutiny, ""Cars"" starts to look more and more Cronenberg-ian, in which the pornography of auto fetishism in ""Crash"" actually gets put into practice. Let's meet the Flintstones again. Similar to the animated series, with its parodic names like Rock Quarry and Cary Granite to corroborate the Jurassic Period setting, both films use car-centric names(Bob Cutlass, Brent Mustangburger) as a means of harmonizing its metal beings with this variant earth. But when it comes to places, in which Bedford becomes Bedrock,  the conversion process stalls in ""Cars 2"" stalls, leaving the names of Paris, Tokyo, and London in its original incarnation, and furthermore, the landmarks of the cities(for instance, the Eiffel Tower) remain unaltered. Where are we, exactly? In ""Planet of the Apes"", the astronaut learns that he traveled across time, not space, when he discovers Lady Liberty in ruins, decapitated and rusting, along the shoreline of what turns out to be the Atlantic Ocean. Dr. Zaius' best efforts to perpetuate the long-standing notion of simian superiority is undermined by a chimpanzee, the archaeologist Cornelius, who unearths artifacts which proves that apes evolved from man during his cave excavations in the forbidden zone. ""Cars"" shares with ""Planet of the Apes"" the same conspiracy: the suppression of evolution. While remaining silent on the subject of man, despite the cars' admission that dinosaurs existed, they give themselves away, therefore deeming full disclosure of the timeline a moot point. Unlike Dreamworks, whose ""Shrek"" films employ a lot of pop culture references, Pixar avoids such anachronisms(the post-modernism of pastiche) yet in ""Cars"", Kenny G.'s ""Songbird"" scores a cheap laugh when a car gang puts Mack to sleep with the easy-listening jazz, causing the truck to lose his precious cargo(Lightning McQueen). This instrumental, like the videotape in ""Wall-E"", proves that man existed. Quite possibly, he's the missing link. Bolstering this theory, a VW bus, an auto-hippie, without any spoofing appellation, names Hendrix, after a military jeep voices his displeasure with the metalized version of ""The Star-Spangled Banner"". This is our earth, not some near-identical equivalent, like the one in the Tim Burton remake, where the film ends with a man staring aghast at the Lincoln Memorial, augmented with ape-like features. These cars are partly human. Vestiges of their humanity can be glimpsed in their faces. In addition to the eyes, Lightning has a tongue, while Mater sports buckteeth like a hayseed. And somewhere in the recesses of their ""brains"", these evolved vehicles remember sex. In ""Cars"", Mater throws Lightning into a homosexual panic as the tow-truck uses his hook on the auto racing car's undercarriage(read; sodomy). Likewise, the spy in ""Cars 2"", as suggested by the double entendre inherent in the name Holly Shiftswell, denotes a woman who was mustard in the sack. Unlike ""Planet of the Apes"", perhaps the conspiracy is an extra-diegetic one. In ""Cars"", Sally waxes nostalgic about Radiator Springs in the fifties. This history runs concurrently with the our timeline. What if she's lying? What if the conspiracy is the film itself, in which the narrators, both omniscient and first-person are fallible? In the climactic race for the coveted Piston Cup(""Cars""), a blimp hanging over the stadium reads ""Light Year"". It's a clue. Exactly what year is it in this planet of the cars? Maybe these aren't Anno Domini times.",Cars 2,Walt Disney Studios Motion Pictures,"June 24, 2011","['Comedy', 'Animation']",4,Shiira,"Aug  5, 2011",https://www.metacritic.com/movie/cars-2/user-reviews
Amazing film Amazing film  Amazing film Amazing film Amazing film Amazing film Amazing film Amazing film Amazing film Amazing film Amazing film Amazing film Amazing film Amazing film Amazing film,Cars 2,Walt Disney Studios Motion Pictures,"June 24, 2011","['Comedy', 'Animation']",9,Sime88,"Jun 27, 2011",https://www.metacritic.com/movie/cars-2/user-reviews
"This movie is pretty much like it's predecessor in that it is full of slick visuals, light plot and sub-plot to keep children tuned-in. Unfortunately, my kids fell asleep halfway through. I enjoyed the movie. I enjoyed the pre-movie short featuring the ""Toy Story 3"" gang even more so. Go figure!",Cars 2,Walt Disney Studios Motion Pictures,"June 24, 2011","['Comedy', 'Animation']",6,petegutz2,"Jul 15, 2011",https://www.metacritic.com/movie/cars-2/user-reviews
"I have now seen the movie Cars 2 3 times and in between have refreshed my memory of Cars. Cars 2 is FANTASTIC!! It's funny, it's clever and it's the best sequel to any movie that has been produced in a very long time. I wondered where Lightning and the other wonderful characters would end up after Radiator Springs. Total props to the creative folks at Pixar! Once again the talented people there have transformed a surreal place, time and characters to a mind blowing realistic world.  To the people that have complained about taking the America out or not making McQueen the star attraction, for one, the movie is ""CARS 2."" Not Lightning McQueen. You all must have owned a lemon when you were much younger and you are bitter and jealous. For the ones that thought Cars 2 was ""violent"" for their children to see. I will not and would hope Disney would never apologize for the grown up interactions in the movie since Cars came out in 2006. Against your will your children have grown up and amazingly so did the characters and concept of the movie. Did your child enjoy ALL of the Shrek movies? What about the Toy Story movies? How about the Suite life of Zack and Cody? Regardless of what your personal, out of date opinion is of Cars 2 is, they seamlessly integrated new characters, an interesting mission with real world facts and may have even set up the chance for a spin off. What will you do then? Tell your child nothing changes? No one grows up? Good luck. Get over your self. Kids love this movie. So what's wrong with you?",Cars 2,Walt Disney Studios Motion Pictures,"June 24, 2011","['Comedy', 'Animation']",10,JAmph,"Jul 20, 2011",https://www.metacritic.com/movie/cars-2/user-reviews
"What?!?!?! Pixar can make a bad film?! The Apocalypse really is near! LOL. I saw this while in Minnesota with my cousins, expecting an enjoyable experience. Sadly, it felt lie I was watching one of those straight-to-video Disney films they keep making. That doesn't mean it's unbearable. The jokes are kind of amusing, and it accidentally spoofs the summer blockbuster. I think it would have been good, if only Mater hadn't been made the main character. That really reminds you of Family Matters making Urkel the main character.",Cars 2,Walt Disney Studios Motion Pictures,"June 24, 2011","['Comedy', 'Animation']",6,buellerbueller,"Aug 27, 2011",https://www.metacritic.com/movie/cars-2/user-reviews
"Well Pixar has done it again. Cars 2 may not be the best Pixar has done , it is still fun to watch. Many new voice actors were brought in for this movie, Eddie Izzard, Jeff Gordon, Michael Caine, Jeff Garlin, Bruce Campbell and many others, my favorite was Michael Caine. Caine is good in most things, and this spy character he pulls off perfectly. AS with most Pixar movies the animation is top notch, and the final 25 minutes are great amounts of CG. The film does start out kind of stupid but it then gets really entertaining. My only gripe i have about the movie, is how it differs a lot from the first film, the first film was a racing movie and very heartwarming, this one is more of an action movie and spy movie than a racing movie, plus the plot is all over the place. But the comedy is still spot on with this movie, it still has all the original characters as the original, Mater, Sally, Flo, Ramone, Sarge, Filmore, Guido, Luigi, the only one not there is Doc Hudson. Now i was wondering how they were going to do Doc for the movie, if they were going to kill him off, or if they were going to get another voice actor for him like they did for Slinky in the new Toy Story. Speaking of Toy Story there is a fantastic short film before the movie that is about all the Toy Story 3 characters having a hawaian vacation. if you are looking for a decent animated film definitely check this out.",Cars 2,Walt Disney Studios Motion Pictures,"June 24, 2011","['Comedy', 'Animation']",6,skeletonking123,"Sep 10, 2011",https://www.metacritic.com/movie/cars-2/user-reviews
"""Cars 2"" Has took away from me sweet 90 minutes, Which I will never ask back.I really loved the world race thing,good job Disney.A nice experience of relaxing movie, which combines action,fantasy, and extremely fun  and epic cars world, Which I wish to visit only in my dreams.83/100.",Cars 2,Walt Disney Studios Motion Pictures,"June 24, 2011","['Comedy', 'Animation']",8,Reviewhunter,"Feb  5, 2012",https://www.metacritic.com/movie/cars-2/user-reviews
"You may call it a crime to like ""Cars 2"", but I truly did. While its storytelling isn't spectacular and has similar elements that has been done before, it has visuals, humor, and well written scenes that somehow make up for it. ""Cars 2"" is a kid film that isn't shallow and stupid, it's complex and full of fun energy. It could be the worst Pixar film, but it's better than nearly three-fourths of the animated films that come out today.",Cars 2,Walt Disney Studios Motion Pictures,"June 24, 2011","['Comedy', 'Animation']",8,jeff_reviews,"Jul  4, 2013",https://www.metacritic.com/movie/cars-2/user-reviews
"There is a little bit of fun to be had, but Cars 2 is a very messy and incoherent film that made the fatal mistake of making the comic relief from the first Cars the main character of this one.",Cars 2,Walt Disney Studios Motion Pictures,"June 24, 2011","['Comedy', 'Animation']",4,WheelzFourReelz,"Dec 29, 2014",https://www.metacritic.com/movie/cars-2/user-reviews
